atitlenames,btime,tags,url,province,district,won2,won3,won_num2,won_num3,lot_date,news,mday,num2,num3
ลูกแก้ว แม่ชี และสิ่งลี้ลับ! เผยเลขเด็ดคำชะโนด1-2 ออกมาเป็นเลขเดียวกัน,28/6/2017 17:25,คำชะโนด,http://www.thairath.co.th/content/986700,อุดรธานี,บ้านดุง,FALSE,FALSE,NA,NA,1/7/2017 16:00,thairath,28,28 14 25 25 25 25,"569, 108 100,"
ดังที่สุด งวดนี้! เมื่อทะเบียนรถนายกรัฐมนตรี ไปตรงกับอายุ‘อดีตนายกฯปู’ (คลิป),28/6/2017 13:46,"ทะเบียน, คนดัง",http://www.thairath.co.th/content/986405,ขอนแก่น,บ้านไผ่,FALSE,FALSE,NA,NA,1/7/2017 16:00,thairath,28,50 28 20 21 50 29 50 05 10 51 80,100
ดูเลย! เลขในขันน้ำมนต์คำชะโนด คอหวยจัดหนัก ชุดใหญ่ไฟกะพริบ,28/6/2017 12:24,คำชะโนด,http://www.thairath.co.th/content/986357,อุดรธานี,บ้านดุง,FALSE,FALSE,NA,NA,1/7/2017 16:00,thairath,28,"28 11 03, 03, 76, 67 65, 58, 59,","725 560, 065 865"
ชั่วโมงเร่งด่วน สาวลาวสุดอั้นคลอดลูกในรถ คอหวยอยากรู้ ตามดูเลขทะเบียน,28/6/2017 11:29,"ทะเบียน, คลอด",http://www.thairath.co.th/content/986293,กรุงเทพมหานคร,บางแค,FALSE,FALSE,NA,NA,1/7/2017 16:00,thairath,28,28 28 43 88 40 11,0
คนรักเลขถอดสูตรคำนวณ ตะเคียน 3 ท่อนให้โชค งวดที่แล้วถูกไปเป็นล้าน (คลิป),27/6/2017 13:45,"วัด, ตะเคียน",http://www.thairath.co.th/content/985373,ชัยนาท,เมืองชัยนาท,FALSE,FALSE,NA,NA,1/7/2017 16:00,thairath,27,27 10 47 62,200 100 405
ฮือฮา! แม่ชีกรุงเทพฯ ได้ลูกแก้วสีแดง จากบ่อศักดิ์สิทธิ์คำชะโนด 2 (คลิป),23/6/2017 15:41,"คำชะโนด, ลูกแก้ว",http://www.thairath.co.th/content/981532,อุดรธานี,บ้านดุง,FALSE,FALSE,NA,NA,1/7/2017 16:00,thairath,23,23 20 70 15 69 70,0
เธอๆรถเป็นอะไร? อ่อ ตัวเห้...เกาะห้องเครื่อง ไล่ตั้งนานกว่าจะแยกย้าย,22/6/2017 9:36,"ตัวเห้, พระ",http://www.thairath.co.th/content/980278,เลย,เมือง,FALSE,FALSE,NA,NA,1/7/2017 16:00,thairath,22,22 19,100
สมนาคุณตะเคียนริมทาง ขับรถผ่านกระซิบเลขเด็ด ได้8แสน เลยมาทำหลังคาถวาย,19/6/2017 19:06,ตะเคียน,http://www.thairath.co.th/content/977763,กำแพงเพชร,เมืองกำแพงเพชร,FALSE,FALSE,NA,NA,1/7/2017 16:00,thairath,19,19 60 15 16,"055 142 142 800,"
กบ 5 ขามหาโชค เลขเด็ดตัวดังใกล้หวยออก รีบรูดดูกันรัวๆ (คลิป),16/6/2017 11:43,กบ,http://www.thairath.co.th/content/974512,นครพนม,นาแก,FALSE,FALSE,NA,NA,16/6/2017 16:00,thairath,16,16 48,195
แห่บวงสรวงขอโชค มะพร้าวพญานาค ไปดู เลขไหนแรงแซงโค้งสุดท้าย,16/6/2017 11:21,พญานาค,http://www.thairath.co.th/content/974455,นครพนม,ธาตุพนม,FALSE,FALSE,NA,NA,16/6/2017 16:00,thairath,16,16 54 17 54 17 54,0
เขียนเลขใส่กระดาษ! ลุงเอี่ยม ขอทานเงินล้าน ให้โชคหลายงวดติด ให้พรคนไทยเฮงๆ (คลิป),16/6/2017 8:13,วัด,http://www.thairath.co.th/content/974147,นครปฐม,เมือง,FALSE,FALSE,NA,NA,16/6/2017 16:00,thairath,16,67,0
“เลขเด็ด”,16/6/2017 5:01,คนดัง,http://www.thairath.co.th/content/973397,เลย,เมือง,FALSE,FALSE,NA,NA,16/6/2017 16:00,thairath,16,"88 25 38 18,",0
ไทยแลนด์โอนลี่!! คึกคักวันหวยออก คนแห่ส่องเลขอ่างน้ำมนต์ กุมารทอง(คลิป),16/6/2017 2:58,"ขัน, พระ, กุมาร",http://www.thairath.co.th/content/974218,พระนครศรีอยุธยา,บางไทร,FALSE,FALSE,NA,NA,16/6/2017 16:00,thairath,16,15 10 56 15 30,0
มาถูกวัน!! พี่เห้...ไซส์บิ๊กหนักกว่า 100 บุกบ้านคนเลขที่ 53 ก่อนหวยออก,16/6/2017 1:29,ตัวเห้,http://www.thairath.co.th/content/974170,พระนครศรีอยุธยา,เมือง,FALSE,FALSE,NA,NA,16/6/2017 16:00,thairath,16,15 53 64 10,100 100
แห่ขอเลขเด็ด 'เรือโบราณตะเคียน' อายุ100ปีตรึม หลังให้โชคถูกหวยหุ้นแล้ว,15/6/2017 21:08,"ตะเคียน, เรือ",http://www.thairath.co.th/content/974125,กระบี่,เขาพนม,FALSE,FALSE,NA,NA,16/6/2017 16:00,thairath,15,15 75 48 10 57 13 14,100 100 100 100 100 140
พรุ่งนี้รวย งู3ตัวกัดกันวันใกล้หวยออก นักวิเคราะห์ ถอดสมการตัวเลขด่วน,15/6/2017 19:22,งู,http://www.thairath.co.th/content/974035,ฉะเชิงเทรา,บางปะกง,FALSE,FALSE,NA,NA,16/6/2017 16:00,thairath,15,15 60 31 50,0
ลอดท้องมังกรโชคดีจะมา คนระยองไปหาดพยูน ได้เลขเด็ดกลับมาอื้อ,15/6/2017 19:15,มังกร,http://www.thairath.co.th/content/974013,ระยอง,บ้านฉาง,FALSE,FALSE,NA,NA,16/6/2017 16:00,thairath,15,15 60 35 40 35,0
คอหวยปักหลักส่องเลขเด็ด 'พุ่มพวง' เชื่อทุกครั้งที่เจอ แฟนเพลงจะได้โชค,15/6/2017 15:00,"วัด, พุ่มพวง",http://www.thairath.co.th/content/973717,สุพรรณบุรี,สองพี่น้อง,FALSE,FALSE,NA,NA,16/6/2017 16:00,thairath,15,15 60 25 17 25,0
พบหม้อดินลงอักขระ ใกล้วัดที่ชัยนาท เปิดเจอสิ่งของ คาดใช้แก้คุณไสย (คลิป),15/6/2017 14:54,โบราณ,http://www.thairath.co.th/content/973720,ชัยนาท,เมืองชัยนาท,FALSE,FALSE,NA,NA,16/6/2017 16:00,thairath,15,15 16,0
ส่องก่อนซื้อ เลขเด็ดเจ้าแม่ตะเคียน ชาวบ้านเผยเคล็ดลับดูชัดๆ ไม่ต้องเพ่ง,15/6/2017 14:22,ตะเคียน,http://www.thairath.co.th/content/973667,อำนาจเจริญ,เมืองอำนาจเจริญ,FALSE,FALSE,NA,NA,16/6/2017 16:00,thairath,15,53  15 65 53,"100 753, 100 753 753 753"
ฮือฮา! ต้นหมากแดงคล้ายพญานาค คนรักเลขไม่พลาดถูไถ บอกดวงใครดวงมัน,15/6/2017 13:35,พญานาค,http://www.thairath.co.th/content/973582,พะเยา,ดอกคำใต้,FALSE,FALSE,NA,NA,16/6/2017 16:00,thairath,15,15 60,0
ตะเคียนขวางคลอง ไม่ยอมขึ้น! พระ-ฤาษีร่วมบวงสรวง บอกตรงๆเลขเด็ด 2 ตัว (คลิป),15/6/2017 13:03,ตะเคียน,http://www.thairath.co.th/content/973553,ประจวบคีรีขันธ์,บางสะพาน,FALSE,FALSE,NA,NA,16/6/2017 16:00,thairath,15,15 20 60 32 43,200
สุดแปลก ต้น‘น้ำตานางไม้’ในป่าจ.ตาก เหมือนฝนตกตลอดเวลา คอหวยแห่ขูดหาเลข,15/6/2017 12:44,ต้นไม้,http://www.thairath.co.th/content/973510,ตาก,แม่สอด,FALSE,FALSE,NA,NA,16/6/2017 16:00,thairath,15,15 52 80,0
งวดนี้เลขไหนจะมา รถนายกฯ-พุ่มพวง นักเสี่ยงโชคกว้านซื้อเกลี้ยงแผง,14/6/2017 20:06,"ทะเบียน, พุ่มพวง",http://www.thairath.co.th/content/972887,ชัยนาท,เมือง,FALSE,FALSE,NA,NA,16/6/2017 16:00,thairath,14,"11, 25 14 11 25",0
ขนลุกซู่ พุ่มพวงแต่งชุดเสือ นั่งหน้าเมรุดูคอนเสิร์ต ก.ก.วัดบอกมาทุกปี,14/6/2017 14:51,พุ่มพวง,http://www.thairath.co.th/content/972570,สุพรรณบุรี,สองพี่น้อง,FALSE,FALSE,NA,NA,16/6/2017 16:00,thairath,14,14 25 13 14 25 13 15 15,0
แม่จ๋าหนูเห็นเลข! คอหวยลุ้น เด็กเห็น 79 ที่รากต้นมะเดื่อยักษ์คำชะโนด,14/6/2017 13:30,คำชะโนด,http://www.thairath.co.th/content/972443,อุดรธานี,บ้านดุง,FALSE,FALSE,NA,NA,16/6/2017 16:00,thairath,14,"79 14 60 11 20,","327 ,000 327"
รวมเลขปริศนา พารวย' สามีหญิงใบ้ จัดชุดใหญ่ไฟกะพริบ,14/6/2017 6:05,หญิงใบ้,http://www.thairath.co.th/content/971563,ปทุมธานี,เมืองปทุมธานี,FALSE,FALSE,NA,NA,16/6/2017 16:00,thairath,14,11 11 50 15 11 25  11 17 25 25 25 15 13 13 10 25,489 943
ตาบอกเกิดมา 82 ปีเพิ่งเคยเห็น กบสีทอง กระโดดขึ้นศาลพระภูมิเชื่อให้ลาภ,13/6/2017 15:30,กบ,http://www.thairath.co.th/content/971518,สุราษฎร์ธานี,กาญจนดิษฐ์,FALSE,FALSE,NA,NA,16/6/2017 16:00,thairath,13,82 13 60 60 12 82 82,0
ไม่ผิดหวัง ขูดกันสดๆ ตะเคียนวัดศรีโคมคำ แป้งถู มือถือถ่าย เลขเด้ง (คลิป),13/6/2017 12:24,ตะเคียน,http://www.thairath.co.th/content/971258,พะเยา,เมืองพะเยา,FALSE,FALSE,NA,NA,16/6/2017 16:00,thairath,13,13 50 15,0
เผยทีเด็ด เจ้าแม่ตะเคียน4G หาเจอด้วย GPS ใช้มือถือถ่าย เลขเด้ง,12/6/2017 15:44,ตะเคียน,http://www.thairath.co.th/content/970623,อ่างทอง,วิเศษชัยชาญ,FALSE,FALSE,NA,NA,16/6/2017 16:00,thairath,12,12 44 64 42,700 700 553
พบเต่าสีทอง บนกระดองลายพระสมเด็จและยันต์ 8 ทิศ คอหวยขอนแก่นแห่ขอโชค (คลิป),12/6/2017 10:27,"พระ, เต่า",http://www.thairath.co.th/content/969963,ขอนแก่น,ชนบท,FALSE,FALSE,NA,NA,16/6/2017 16:00,thairath,12,12 53 16 16 29 24,287 100
ตามล่าเลขเด็ด สาวเมืองนนท์ใช้GPSนำทาง ช่วย 3 เจ้าแม่ จมน้ำหน้าวัด,9/6/2017 18:20,ตะเคียน,http://www.thairath.co.th/content/967882,อ่างทอง,วิเศษชัยชาญ,FALSE,FALSE,NA,NA,16/6/2017 16:00,thairath,9,44 25,0
มาแล้ว เลขเด็ดแม่ผึ้ง 25ปี‘พุ่มพวง’แห่เขย่าติ้ว ถูต้นไทรวัดทับกระดาน,9/6/2017 14:27,"คนดัง, พุ่มพวง",http://www.thairath.co.th/content/967640,สุพรรณบุรี,สองพี่น้อง,FALSE,FALSE,NA,NA,16/6/2017 16:00,thairath,9,25 25 (13 25 12,0
คำชะโนด 2! แชร์เต็มโซเชียล แห่ไหว้พญานาควัดป่าคลอง 11 เลขเด็ดเพียบ,8/6/2017 6:05,"พญานาค, วัด",http://www.thairath.co.th/content/965608,ปทุมธานี,หนองเสือ,FALSE,FALSE,NA,NA,16/6/2017 16:00,thairath,8,10 11 11 27 11 11 11,489 943 305
บิ๊กตู่ เยือนจันทบุรีใช้รถตู้หรู ทะเบียนเลขสวย ชมงาน ‘มหานครผลไม้’ (คลิป),7/6/2017 13:07,"นายก, ทะเบียน",http://www.thairath.co.th/content/965270,จันทบุรี,เขาคิชฌกูฏ,FALSE,FALSE,NA,NA,16/6/2017 16:00,thairath,7,25,0
ก้ามปูนักเลง ยืนกลางถนนที่อ่างทอง ชาวบ้านเชื่อศักดิ์สิทธิ์ แห่ถูขอเลข,6/6/2017 11:50,ปู,http://www.thairath.co.th/content/963962,อ่างทอง,เมืองอ่างทอง,FALSE,FALSE,NA,NA,16/6/2017 16:00,thairath,6,60 78,100 100
แตกตื่นทั้งประเทศ! พบสัตว์ประหลาด คนแห่กราบไหว้ คิดสร้างวิหารรำลึก (ชมคลิป),3/6/2017 15:15,วัว,http://www.thairath.co.th/content/961415,แพร่,เมือง,FALSE,FALSE,NA,NA,16/6/2017 16:00,thairath,3,60 50 55,0
ชาวบ้านนาแก ลือพญานาคโผล่กลางสระ แห่ขอหวยล้นวัดป่าสามัคคีธรรม,1/6/2017 15:12,"วัด, พญานาค",http://www.thairath.co.th/content/959412,นครพนม,นาแก,FALSE,FALSE,NA,NA,1/6/2017 16:00,thairath,1,16 87 55,0
แรงทะลุแผง 92-29 เลขผีผูกคอตาย ตลาดมวกเหล็กหาซื้อไม่ได้ (คลิป),1/6/2017 10:12,ผี,http://www.thairath.co.th/content/959037,สระบุรี,มวกเหล็ก,FALSE,FALSE,NA,NA,1/6/2017 16:00,thairath,1,52 29 92 32 48,0
คอหวยตาลุกวาว ลุ้น!! เลขเด็ด 8-7-2 เจ้าแม่ตะเคียนทองที่ชัยนาท (คลิป),1/6/2017 3:06,ร่างทรง,http://www.thairath.co.th/content/958830,ชัยนาท,สรรพยา,FALSE,FALSE,NA,NA,1/6/2017 16:00,thairath,1,13 31 11 16 87 82 82 14,200 200
ใกล้หวยออก คนแห่ขอโชคแม่ตะเคียน วัดสี่ร้อยเมืองอ่างทอง เล่นเลข 35-948,1/6/2017 0:15,"วัด, ตะเคียน",http://www.thairath.co.th/content/958768,อ่างทอง,วิเศษชัยชาญ,FALSE,FALSE,NA,NA,1/6/2017 16:00,thairath,1,31 60 35,948
คนครึ่งหมื่นบวงสรวงเจ้าแม่ตะเคียนยักษ์ ส่องเลขวันสุดท้ายก่อนหวยออก(คลิป),31/5/2017 17:42,ตะเคียน,http://www.thairath.co.th/content/958542,มหาสารคาม,กันทรวิชัย,FALSE,FALSE,NA,NA,1/6/2017 16:00,thairath,31,"92, 50, 31 60 10 49, 30 38 53 92, 50,","550, ,000 ,310 984, 550,"
ศพโบราณ “ลุงเชย วัดมะกอก” สุดเฮี้ยนให้โชคให้ลาภ?!,31/5/2017 14:01,คนดัง,http://www.thairath.co.th/content/958395,เลย,เมือง,FALSE,FALSE,NA,NA,1/6/2017 16:00,thairath,31,0,120
เบิ่งดีๆ อีหล่า พรุ่งนี้เลขสิออกแล้ว พญานาคท่านคงมาให้โชค (คลิป),31/5/2017 11:30,พญานาค,http://www.thairath.co.th/content/958112,นครพนม,ธาตุพนม,FALSE,FALSE,NA,NA,1/6/2017 16:00,thairath,31,31 54 17 17,0
กลับไปคำชะโนด...ตามสัญญา! 'หญิงใบ้' รวมเลขมหัศจรรย์,31/5/2017 6:09,"คำชะโนด, หญิงใบ้",http://www.thairath.co.th/content/957625,อุดรธานี,บ้านดุง,FALSE,FALSE,NA,NA,1/6/2017 16:00,thairath,31,"28 60 46 62 24 12 20, 30,",๔๕๔ ๔๔๕ 100 500 143 200 200
ชาวพิมายตื่น กล้วยออกปลีกลางลำต้น บวกลบคูณหาร เลขเบิ้ลก็มี 960 ก็มา,30/5/2017 21:30,กล้วย,http://www.thairath.co.th/content/957732,นครราชสีมา,พิมาย,FALSE,FALSE,NA,NA,1/6/2017 16:00,thairath,30,77 30 77 35 21 11 21 21 77,961 960 231 231 961 960
เลขผีบอกมาแรง! ผัวห่วงเมีย จดให้ไว้ 2 ตัวเน้นๆ ก่อนไปผูกคอตาย,30/5/2017 17:27,ผี,http://www.thairath.co.th/content/957508,สุรินทร์,รัตนบุรี,FALSE,FALSE,NA,NA,1/6/2017 16:00,thairath,30,13 30 60 52 29 92 25 29 92 13 80,0
แม่แมวทำอดลุ้น! คอหวยกระบี่ฮือจะไปหาเลขเด็ด ลูกแมว 8 ขา 1 หัว,30/5/2017 15:54,แมว,http://www.thairath.co.th/content/957357,กระบี่,ปลายพระยา,FALSE,FALSE,NA,NA,1/6/2017 16:00,thairath,30,30 24 12 28 48 20 20,143
อย่างมงาย! พระดึงสติแต่คอหวยเมิน ขูดตะเคียนหาเลขเด็ด เชื่อให้โชค!,30/5/2017 15:40,ตะเคียน,http://www.thairath.co.th/content/957303,นครปฐม,นครชัยศรี,FALSE,FALSE,NA,NA,1/6/2017 16:00,thairath,30,30,200 200
ฮือฮา หวยลูกแก้วยักษ์ ขุดเจอพร้อมพระพุทธรูป มือถือถ่ายเลขเด้งเข้าตา,30/5/2017 14:15,ลูกแก้ว,http://www.thairath.co.th/content/957208,อุดรธานี,พิบูลย์รักษ์,TRUE,FALSE,61,NA,1/6/2017 16:00,thairath,30,"30 10 61 88 10 18 40 20 82 42 82, 42 10",100 742 742
โชคมากับสายน้ำ เจอคู่ปลาไหลสีทอง ชาวบ้านชะอวดแห่ขอเลขเด็ด (คลิป),30/5/2017 13:45,ปลาไหล,http://www.thairath.co.th/content/957075,นครศรีธรรมราช,ชะอวด,FALSE,FALSE,NA,NA,1/6/2017 16:00,thairath,30,60 40 40 30,0
หนุ่มใหญ่ฝันเห็นคนท้องอยู่หน้าบ้าน เข้าสวนเจอกล้วยไข่ออกลูกกลางลำต้น,30/5/2017 13:40,กล้วย,http://www.thairath.co.th/content/957128,สงขลา,สะเดา,FALSE,FALSE,NA,NA,1/6/2017 16:00,thairath,30,56 30 60 56,0
งวดนี้เฮแน่ เห้น้อยมารอขอเข้าร้าน เจ้าของถอดทองคล้องคอขอโชคลาภ (คลิป),30/5/2017 11:52,ตัวเห้,http://www.thairath.co.th/content/956972,เลย,เมืองเลย,FALSE,FALSE,NA,NA,1/6/2017 16:00,thairath,30,30 45 20 42 34 10,102
คอหวยอยากรวยซ้ำ ลุ้นเลขเด็ด วันบรวงสรวงเจ้าแม่ตะเคียนทอง บ้านขี้เหล็ก,29/5/2017 23:01,"ป่าช้า, ตะเคียน",http://www.thairath.co.th/content/956587,มหาสารคาม,กันทรวิชัย,FALSE,FALSE,NA,NA,1/6/2017 16:00,thairath,29,31 16 29 10 16 60 31 15 16 31 60,394
เลขเด็ดเมืองแพร่ 168 วิญญาณคุกคุ้มเจ้าหลวง คนเหมาซื้อเกลี้ยงทุกแผง,29/5/2017 17:38,ผี,http://www.thairath.co.th/content/956367,แพร่,เมืองแพร่,FALSE,FALSE,NA,NA,1/6/2017 16:00,thairath,29,29 52 50,168 168 168 168 168 168 168 168 168 100 168
คนแห่ขอโชควัดกู่ดินขาว เพ่งเห็นเลข 7 กับ 5 บนบานถูกหวยจะร่วมสร้างบันได,28/5/2017 23:59,วัด,http://www.thairath.co.th/content/955452,เชียงใหม่,แม่ริม,FALSE,FALSE,NA,NA,1/6/2017 16:00,thairath,28,28 75 16,800
คนแห่ดูจิ้งเหลน 2 หาง ที่วัดสว่างอารมณ์ ไม่พลาดบูชาขอเลขเสี่ยงโชค,28/5/2017 15:50,"วัด, จิ้งจก",http://www.thairath.co.th/content/955172,นครปฐม,นครชัยศรี,FALSE,FALSE,NA,NA,1/6/2017 16:00,thairath,28,28 60 27 60 43,0
ถูกหวย 2งวดติด! แม่ค้าอ่างทองถวายเครื่องเซ่น ขอบคุณตะเคียนพาเฮง (คลิป),27/5/2017 14:36,ตะเคียน,http://www.thairath.co.th/content/954260,อ่างทอง,วิเศษชัยชาญ,FALSE,FALSE,NA,NA,1/6/2017 16:00,thairath,27,"50 30, 27 50 30,",",000 ,000"
แม่งูเอ๋ย งวดนี้เลขไหนเด็ด! ผญบ.รื้อกองฟาง เจอเหลือมกกไข่ หวิดโดนกัด,24/5/2017 18:18,งู,http://www.thairath.co.th/content/951448,นครนายก,บ้านนา,FALSE,FALSE,NA,NA,1/6/2017 16:00,thairath,24,24 55 10 15 15,0
หรอยๆ บิ๊กตู่ เยือนถิ่นทักษิณทั้งเต้น-ชม-ชิม คนตั้งตารอ เลขเด็ดรถนายก,24/5/2017 17:30,ทะเบียน,http://www.thairath.co.th/content/951410,สงขลา,เมือง,FALSE,FALSE,NA,NA,1/6/2017 16:00,thairath,24,24,0
กู้ชีพแปดริ้วทำคลอดสาวท้องแก่ ได้ลูกชายหน้าโชว์รูมรถให้ชื่อ มาสด้า (คลิป),23/5/2017 18:32,คลอด,http://www.thairath.co.th/content/950355,ฉะเชิงเทรา,แปลงยาว,FALSE,FALSE,NA,NA,1/6/2017 16:00,thairath,23,23 30 29,0
เชื่อ ศรัทธา โชคลาภ' เข้าทุกงวดที่ 'คำชะโนด' (ชมคลิป),16/5/2017 6:09,"คำชะโนด, หญิงใบ้",http://www.thairath.co.th/content/941945,อุดรธานี,เมือง,FALSE,FALSE,NA,NA,16/5/2017 16:00,thairath,16,0,200
หัวเรือไม้ตะเคียน ตลาดน้ำไทรน้อย ให้โชค คนนำชุดไทยถวายเพียบ,16/5/2017 1:23,ตะเคียน,http://www.thairath.co.th/content/942205,นนทบุรี,ไทรน้อย,FALSE,FALSE,NA,NA,16/5/2017 16:00,thairath,16,",25 15 52 25","731, 731"
ต้นมะพร้าวแตกยอด คล้ายเศียรพญานาค แห่ไหว้ขอโชค ให้เลขงวดก่อนถูกหลายแสน,16/5/2017 1:02,"พญานาค, มะพร้าว",http://www.thairath.co.th/content/942203,แพร่,เมืองแพร่,FALSE,FALSE,NA,NA,16/5/2017 16:00,thairath,16,"16, 15 60 33 16,",165
แต่งขันธ์ 5 ขอพรต้นยางนากว่า 100 ปี ที่เพชรบูรณ์ ได้เลขเด็ดเสี่ยงโชค,16/5/2017 0:36,ยาง,http://www.thairath.co.th/content/942198,เพชรบูรณ์,วังโป่ง,FALSE,FALSE,NA,NA,16/5/2017 16:00,thairath,16,"57, 15 10 45 50 57 25  55",100 100 100
พาเด็กขูดหวยคำชะโนด เชื่อดวงดีกว่าผู้ใหญ่ ฮือฮา เจอตุ๊กแก 3 พี่น้อง,15/5/2017 20:01,"คำชะโนด, ตุ๊กแก",http://www.thairath.co.th/content/941975,อุดรธานี,เมือง,FALSE,FALSE,NA,NA,16/5/2017 16:00,thairath,15,15 11,302
ท้าดวลเลขเด็ด เจ้าแม่ตะเคียนพันปีที่เลย ลูบแป้งเลขเด้ง (คลิป),15/5/2017 18:54,ตะเคียน,http://www.thairath.co.th/content/941883,เลย,เมืองเลย,FALSE,FALSE,NA,NA,16/5/2017 16:00,thairath,15,15 60 60 32 32 28 60 15,"500 ,000"
