atitlenames,btime,tags,url,province,district,won2,won3,won_num2,won_num3,lot_date,news,mday,num2,num3
ฮือฮา!! จิ้งจก 2 ตัว เปิดศึกสู้กันดุเดือด เซียนหวยแห่ตีเลขเด็ด ตรงเลขดังอีก กวาดซื้อเกลี้ยงแผง,29/11/2016 15:59,#จิ้งจก #ตีเลข #สู้กัน #หวย #ฮือฮา #เกลี้ยงแผง #เปิดศึก #เลขดัง #เลขเด็ด,https://www.khaosod.co.th/special-stories/news_120046,นครราชสีมา,ปากช่อง,FALSE,FALSE,NA,NA,1/12/2016 16:00,khaosod,29,28,0
"มาแล้ว!! เลขเด็ดเชียงใหม่ เลขมงคลขายเกลี้ยง 7,8 มาแรงสุด เผยงวดนี้ ระวังเลขแทรก-เลขเบิ้ล",28/11/2016 11:09,#หวย #เชียงใหม่ #เลขมงคล #เลขเด็ด #เลขเบิ้ล #เลขแทรก,https://www.khaosod.co.th/breaking-news/news_118335,เชียงใหม่,เมืองเชียงใหม่,FALSE,FALSE,NA,NA,1/12/2016 16:00,khaosod,28,"28 16 59 80 ,32, ,73,","569 100 858 337,"
ชาวบ้านฮือฮา!ถูกหวยตรงๆตีเลขเด็ดปลาช่อนทอง เจ้าของไม่กล้ากิน เชื่อให้โชค-แห่ดูกันแน่น,18/11/2016 13:55,#กระบี่ #ดักไซ #ปลาช่อนทอง #เลขเด็ด #ให้โชค,https://www.khaosod.co.th/around-thailand/news_105082,กระบี่,เขาพนม,FALSE,FALSE,NA,NA,1/12/2016 16:00,khaosod,18,18 67 32 15,0
คอหวยฮือฮา!เจอ “กะหล๊ก” ไม้โบราณจมใต้ลำน้ำหน้าวัดที่แม่อาย ชาวบ้านแห่หาเลขเด็ด,16/11/2016 10:47,#กะหล๊ก #ขอเลขเด็ด #จมใต้น้ำ #เชียงใหม่ #แม่อาย,https://www.khaosod.co.th/breaking-news/news_101430,เชียงใหม่,แม่อาย,FALSE,FALSE,NA,NA,16/11/2016 16:00,khaosod,16,16 30,101
ชาวบ้านสุโขทัยเฮลั่น ร่างทรงแม่ตะเคียน “ย่าผมหอม” ให้เลขเด็ด บอกเสร็จแน่ๆ,15/11/2016 23:09,#,https://www.khaosod.co.th/clips/news_101173,สุโขทัย,บ้านด่านลานหอย,FALSE,FALSE,NA,NA,16/11/2016 16:00,khaosod,15,15 14 15,0
รวมเลขเด็ดมาแล้ว!! เซียนหวยฮือฮาเลขดังระดับโลกมาแรง เลขวันลอยกระทง-เลขมงคลเกลี้ยงแผง,15/11/2016 17:40,#ระดับโลก #วันลอยกระทง #หวย #ฮือฮา #เซียนหวย #เลขดัง #เลขมงคล #เลขเด็ด,https://www.khaosod.co.th/breaking-news/news_100655,เชียงใหม่,เมืองเชียงใหม่,FALSE,FALSE,NA,NA,16/11/2016 16:00,khaosod,15,"15 16 45 54 45 14 14 70, 14 80",",998, ,870, ,594, ,904, 100"
แตกตื่นทั้งทำเนียบ! จู่ๆงูเหลือมเลื้อยเข้าเก๋งคัมรี่ที่ปรึกษาสบ10 ไล่จับวุ่น คอหวยเล็งทะเบียนตีเลขเด็ด,10/11/2016 16:15,#คอหวย #งูเหลือม #ทำเนียบรัฐบาล #ที่ปรึกษาสบ10 #เก๋งคัมรี่,https://www.khaosod.co.th/breaking-news/news_93551,กรุงเทพมหานคร,เมือง,FALSE,FALSE,NA,NA,16/11/2016 16:00,khaosod,10,10 16,0
หนุ่ม อบต.เมืองลับแล เฮลั่นบ้าน ถูกรางวัลที่ 1 รวย 6 ล้าน เผยเลขเด็ดฝันเห็นบ้านแฟนสาว,1/11/2016 22:50,#,https://www.khaosod.co.th/breaking-news/news_79433,อุตรดิตถ์,เมืองอุตรดิตถ์,FALSE,FALSE,NA,NA,16/11/2016 16:00,khaosod,1,52 41 95 96 38,149
โค้งสุดท้ายหวยออก!! คึกคักแห่ซื้อเลขเด็ดกฐิน“พญาเต่างอย” สาวถูกรางวัลที่1โผล่แก้บน-ซื้อเลขเบิ้ล,31/10/2016 15:25,#พญาเต่างอย #รางวัลที่1 #หวย #หวยออก #เลขเด็ด #เลขเบิ้ล #โค้งสุดท้าย,https://www.khaosod.co.th/breaking-news/news_76873,สกลนคร,เต่างอย,FALSE,FALSE,NA,NA,1/11/2016 16:00,khaosod,31,31 30 55,",023,"
แตกตื่นทั้งหมู่บ้าน ลูกหมูประหลาดมี 8 ขา 3 หูอีกตัวไม่มีหัว ชาวบ้านแห่ขอเลขเด็ดซื้อหวยงวดนี้,31/10/2016 13:58,#8ขา #มุกดาหาร #ลูกหมูประหลาด #โชคลาภ,https://www.khaosod.co.th/breaking-news/news_76729,มุกดาหาร,เมืองมุกดาหาร,FALSE,FALSE,NA,NA,1/11/2016 16:00,khaosod,31,31 56,110
นายกฯถูกหวยรวยเอง!! งวดที่แล้วพญาเต่างอยให้โชค งวดนี้ให้เลขเด็ดกฐิน-ตรงเลขมงคล เกลี้ยงแผง,30/10/2016 12:08,#พญาเต่างอย #หวย #เลขมงคล #เลขเด็ด,https://www.khaosod.co.th/breaking-news/news_74789,สกลนคร,เต่างอย,FALSE,FALSE,NA,NA,1/11/2016 16:00,khaosod,30,30 20,",023,"
ลอตเตอรี่เกลี้ยง!! แห่ซื้อเลขเด็ด-เลขมงคล กระแสแรงครองแผงถึงงวด16ธ.ค. เจ้ามือหวยผวา-หายตัว,30/10/2016 11:22,#กระแสแรง #ลอตเตอรี่ #หวย #เลขมงคล #เลขเด็ด,https://www.khaosod.co.th/breaking-news/news_74735,เชียงใหม่,เมืองเชียงใหม่,FALSE,FALSE,NA,NA,1/11/2016 16:00,khaosod,30,"16 59 30 56 07, ,90, 16 59 16 80 82,","101 970, ,470, ,929, 101 100"
เลขเด็ดมาแล้ว!! เลขมงคลมาแรงสุด-เลขเกจิดังขายเกลี้ยงแผง หลายสำนักให้เลขตรงกัน,27/10/2016 9:54,#ลอตเตอรี่ #สลากกินแบ่งรัฐบาล #หวย #เชียงใหม่ #เลขมงคล #เลขเกจิดัง #เลขเด็ด,https://www.khaosod.co.th/breaking-news/news_70430,เชียงใหม่,เมืองเชียงใหม่,FALSE,FALSE,NA,NA,1/11/2016 16:00,khaosod,27,"27 70, ,13 04, ,06, ,16, ,26 16 16 59","101 904, ,970, ,998, ,594, ,964, 101 101 101 123, ,567, ,406, ,456"
เลขมงคลหมดเกลี้ยง!! เซียนหวยได้เลขเด็ดใหม่เพิ่มอีก-แห่ซื้อ เจ้ามือหวยประกาศจ่ายครึ่งเดียว,14/10/2016 15:12,#หมดเกลี้ยง #เจ้ามือหวย #เซียนหวย #เลขมงคล #เลขเด็ด,https://www.khaosod.co.th/around-thailand/news_51657,เชียงใหม่,เมืองเชียงใหม่,TRUE,FALSE,98,NA,16/10/2016 16:00,khaosod,14,"14 90, 89, 07, 12, ,14, ,52 12, ,14, ,52",",089 352, 088, ,889,"
ฮือฮาใกล้ออกพรรษา!! มะพร้าวแตกยอดเป็นพญานาค 3 เศียร แห่จุดธูปขอโชคลาภ-เลขเด็ด,13/10/2016 12:36,#พญานาค3เศียร #มะพร้าวแตกยอด #ฮือฮา #เลขเด็ด #แห่ขอโชคลาภ #ใกล้วันออกพรรษา,https://www.khaosod.co.th/around-thailand/news_48966,นครปฐม,นครชัยศรี,FALSE,FALSE,NA,NA,16/10/2016 16:00,khaosod,13,13 50 32,0
ชาวบ้านแห่ตีเลขเด็ด ลูกหมาเกิดใหม่ประหลาดมี 5 ขา เลขที่บ้านเข้าเป้ามาแล้ว,13/10/2016 9:45,#เลขท้าย #เลขเด็ด,https://www.khaosod.co.th/around-thailand/news_48640,เชียงใหม่,จอมทอง,FALSE,FALSE,NA,NA,16/10/2016 16:00,khaosod,13,13,"201 201 102 559,"
เลขเด็ดมาแล้ว!! 9 เลขมงคล หลายสำนักให้ตรงกัน แห่ซื้อเกลี้ยง หวยออกวันพระใหญ่-มีเลขเบิ้ล,13/10/2016 9:25,#9เลขมงคล #วันพระใหญ่ #หลายสำนัก #หวย #เลขเด็ด #เลขเบิ้ล #แห่ซื้อเกลี้ยง,https://www.khaosod.co.th/breaking-news/news_48624,เชียงใหม่,เมืองเชียงใหม่,FALSE,FALSE,NA,NA,16/10/2016 16:00,khaosod,13,13 90 09 92 29 63 16 59 13,990 970 392 559 995 789 904 970
มาแล้ว!! เลขเด็ด‘พญาเต่างอย’ คึกคักแห่ไหว้-งวดที่แล้วถูกอื้อ เข้าฝันอีก-เลขโผล่ท้องเต่า,12/10/2016 14:50,#คึกคักแห่ไหว้ #งวดที่แล้วถูกอื้อ #พญาเต่างอย #มาแล้ว #เข้าฝันอีก #เลขเด็ด #เลขโผล่ท้องเต่า,https://www.khaosod.co.th/breaking-news/news_47540,สกลนคร,เต่างอย,FALSE,FALSE,NA,NA,16/10/2016 16:00,khaosod,12,12 41 13,0
“บิ๊กตู่” กลับถิ่นร.21 เปิดอาคารเฉลิมพระเกียรติ 84 พรรษา เยี่ยมชมตลาด-กลุ่มแม่บ้านรุมดูทะเบียนรถซื้อเลขเด็ด,12/10/2016 13:03,#กรมทหารราบที่ 21 #ชลบุรี #ทะเบียนรถ #ปั๊มน้ำมัน,https://www.khaosod.co.th/breaking-news/news_47341,ชลบุรี,เมือง,FALSE,FALSE,NA,NA,16/10/2016 16:00,khaosod,12,12 21 21 21 21 21 16 21,0
ยิ่งขุดยิ่งเจอ!!หัวมันยักษ์ ล่าสุดหนักกว่า 8 กิโล ชาวบ้านแห่ตีเป็นเลขเด็ด!,11/10/2016 22:10,#,https://www.khaosod.co.th/breaking-news/news_46553,เชียงใหม่,จอมทอง,FALSE,FALSE,NA,NA,16/10/2016 16:00,khaosod,11,58 11,234
ฮือฮาสกลนคร!! มะละกอออกลูกแปลก รูปร่างคล้ายนก ชาวบ้านแห่ตีเลขเด็ด,11/10/2016 19:45,#,https://www.khaosod.co.th/around-thailand/news_46318,สกลนคร,เมือง,FALSE,FALSE,NA,NA,16/10/2016 16:00,khaosod,11,11 30 25,0
ส่องหาเลขเด็ดต้นหมากแตกยอดคล้ายพญานาค ชาวบ้านฮือฮา!เชื่อมาปรากฏกายวันออกพรรษา (คลิป),8/10/2016 16:59,#ต้นหมาก #นครราชสีมา #ปรากฏกาย #พญานาค #วันออกพรรษา #อัญเชิญ #แทงยอด,https://www.khaosod.co.th/breaking-news/news_38974,นครราชสีมา,เสิงสาง,FALSE,FALSE,NA,NA,16/10/2016 16:00,khaosod,8,53 54 10,0
ตื่นข้าวโพดประหลาดออกฝักคล้ายดอกบัว ชาวบ้านเตรียมมาขอดู-ตีเลขเด็ด,6/10/2016 12:55,#ข้าวโพดประหลาด #ดอกบัว #ยางพารา #สุราษฎร์ธานี,https://www.khaosod.co.th/around-thailand/news_36090,สุราษฎร์ธานี,คีรีรัฐนิคม,FALSE,FALSE,NA,NA,16/10/2016 16:00,khaosod,6,60 20,0
วนไปค่ะ!! ไม่ถึงอำนาจเจริญ เซียนหวยหัวเสีย เลขเด็ดยูเทริน์ไปที่ มุกดาหาร ซะงั้น,1/10/2016 17:21,#ป้ายบอกทาง #หวย,https://www.khaosod.co.th/special-stories/news_28969,มุกดาหาร,ดอนตาล,FALSE,FALSE,NA,NA,16/10/2016 16:00,khaosod,1,90 33 33 34 34 86 13 44,400
ฮือฮานาทีสุดท้าย!! เต่าเผือกโผล่ ใต้ฐาน‘พญาเต่างอย’ปรากฏเลขเด็ด ปลาดุกสีทองคอยเฝ้า,1/10/2016 7:59,#ตีเลข #ปลาดุกสีทอง #หวยออก #ฮือฮานาทีสุดท้าย #เต่างอย #เต่าเผือก #เลขเด็ด,https://www.khaosod.co.th/breaking-news/news_28493,สกลนคร,เต่างอย,FALSE,FALSE,NA,NA,1/10/2016 16:00,khaosod,1,52 18 52,352
คอหวยเตรียมตัว สาวอุดรฯโพสโชว์กบประหลาด 5 ขา 16 นิ้ว ชาวบ้านแห่ตีเลขเด็ด,30/9/2016 18:38,#,https://www.khaosod.co.th/special-stories/news_28134,อุดรธานี,เมือง,FALSE,FALSE,NA,NA,1/10/2016 16:00,khaosod,30,30,0
โค้งสุดท้าย!! เลขเด็ด‘พญาเต่างอย’เกลี้ยง เศรษฐี30ล้านโผล่ซื้อชุดใหญ่-เผยเคยยากจน อึ้งเต่าบริวาร,30/9/2016 10:15,#ซื้อชุดใหญ่ #บริวารเต่า #พญาเต่างอย #เลขเด็ด #เศรษฐี30ล้าน #โค้งสุดท้ายหวยออก,https://www.khaosod.co.th/breaking-news/news_27403,สกลนคร,เต่างอย,FALSE,FALSE,NA,NA,1/10/2016 16:00,khaosod,30,30 30 30 56 30 10 55 30,120
แห่ดูรูพญานาคโผล่กลางสวนยางร่างทรงบอกเป็น “ปู่ศรีสุทโธ” มาหาบริวาร ชาวบ้านตีเลขเด็ดเขียนบอกกันจะๆ,29/9/2016 18:21,#กราบไหว้ #ขอหวย #คำชะโนด #รูพญานาค #สวนยาง #อุดรธานี #เลขเด็ด,https://www.khaosod.co.th/breaking-news/news_26817,อุดรธานี,น้ำโสม,FALSE,FALSE,NA,NA,1/10/2016 16:00,khaosod,29,"29 17 26 58 15 41 15 26 20 66 17 50 66, 54","500 128 747,"
ชาวบ้านแตกตื่นแห่ขอเลขเด็ด”ลูกควาย 2 หัว” สุดสลดตกลูกไม่นานแม่ควายก็สิ้นใจตายตาม,29/9/2016 13:51,#ควาย 2 หัว #ตกลูก #อุบลราชธานี #แม่ควาย,https://www.khaosod.co.th/around-thailand/news_26372,อุบลราชธานี,พิบูลมังสาหาร,FALSE,FALSE,NA,NA,1/10/2016 16:00,khaosod,29,29 50 62,149 105
หัวปลีก็ไม่รอด!! ชาวบ้านแห่หาเลขเด็ด ป้ายดังยังฮอต น้ำแดงเริ่มวางขอโชค,28/9/2016 18:49,#รวมเลขเด็ด #หวย #เลขเด็ด,https://www.khaosod.co.th/around-thailand/news_25578,มุกดาหาร,ดอนตาล,FALSE,FALSE,NA,NA,1/10/2016 16:00,khaosod,28,66 25 25 66 72 50 90,550 153
สาวแจ้งไก่หาย5ตัวรวด ผญบ.เปิดเล้าตกใจเผ่นแทบไม่ทัน-งูเหลือมใหญ่นอน แห่ตีเลขเด็ด(คลิป),28/9/2016 13:06,#งูกินไก่ #งูเหลือม #เลขเด็ด #ไก่หาย,https://www.khaosod.co.th/around-thailand/news_25079,เชียงใหม่,ไชยปราการ,FALSE,FALSE,NA,NA,1/10/2016 16:00,khaosod,28,28 35 12 12 66 65,615 655
ฮือฮา!!! เต่านับสิบตัวโผล่เดินถนน มุ่งหน้าไปหา‘พญาเต่างอย’ เผยเลขเด็ดพญาเต่างวดนี้,28/9/2016 8:21,#พญาเต่างอย #หวย #เต่างอย #เลขเด็ด,https://www.khaosod.co.th/breaking-news/news_24887,สกลนคร,เต่างอย,FALSE,FALSE,NA,NA,1/10/2016 16:00,khaosod,28,28 80 10 55,0
เลขเด็ดเชียงใหม่มาแล้ว!! อดีตรมต.คำนวณตรงเผงหวยดังป้ายบอกทาง-แย้มงวดนี้มีเลขเบิ้ลด้วย,27/9/2016 13:04,#ป้ายบอกทาง #ป้ายบอกทางหลวง #หวย #หวยป้ายบอกทาง #หวยอดีตรมต. #หวยเชียงใหม่ #หวยเป๊ะ #เลขเด็ด #เลขเด็ดเชียงใหม่,https://www.khaosod.co.th/breaking-news/news_23995,มุกดาหาร,ดอนตาล,FALSE,FALSE,NA,NA,1/10/2016 16:00,khaosod,27,90 27 90 90 90 90 90 44,"150 600 993, 150 600 998 899 897 099 990"
ฮือฮาเต่าใหญ่เดินตาม!! จนท.เทศกิจอุ้มกลับ พบกระดองลายพระสมเด็จ-แห่ขอเลขเด็ด(คลิป),26/9/2016 18:02,#กระดองลายพระสมเด็จ #หวย #ฮือฮา #เต่าใหญ่ #เทศกิจ #เลขเด็ด,https://www.khaosod.co.th/breaking-news/news_23374,นครราชสีมา,พิมาย,FALSE,FALSE,NA,NA,1/10/2016 16:00,khaosod,26,26 53 50 15 10 53,115
ฮือฮาอีก!เจ้าแม่ตะเคียน “วัดเสียวสวาท” เข้าฝันให้เลขเด็ดชาวบ้าน ถูกเบาะๆแค่ 5 งวดติด,25/9/2016 10:17,#ต้นตะเคียน #ถูกหวย #วัดเสียวสวาท #สกลนคร #หวย #เข้าฝัน #แห่ไหว้,https://www.khaosod.co.th/breaking-news/news_22154,สกลนคร,พังโคน,FALSE,FALSE,NA,NA,1/10/2016 16:00,khaosod,25,25 20 20 52 20,500
“แอน”ปลื้มแจกโชคเลขเด็ด เผยแฟนคลับยกเป็น”เจ้าแม่”เปิดสำนักใบ้หวย,22/9/2016 8:30,#,https://www.khaosod.co.th/entertainment/news_19039,เลย,เมือง,FALSE,FALSE,NA,NA,1/10/2016 16:00,khaosod,22,21 42,0
วงการเลขเด็ดตะลึง! ป้ายบอกทาง ออกตรงๆ 3 งวดแล้ว รอลุ้นงวดหน้า?,19/9/2016 20:30,#,https://www.khaosod.co.th/special-stories/news_16566,อำนาจเจริญ,เมือง,TRUE,FALSE,33,NA,1/10/2016 16:00,khaosod,19,33 16 84 50 16,0
ฮือฮา!! ‘แอน ทองประสม’ให้เลขเด็ดงวดนี้ ‘หนึ่ง-ณรงค์วิทย์’-แฟนคลับรับทรัพย์ถ้วนหน้า,16/9/2016 18:56,#แอน #แอน ทองประสม,https://www.khaosod.co.th/entertainment/news_13761,เลย,เมือง,FALSE,FALSE,NA,NA,1/10/2016 16:00,khaosod,16,42,0
เลขเด็ดโค้งสุดท้าย!! กล้วยประหลาด ปลีโผล่ปลายยอด-เป็นงวงช้าง นายกฯฝันเอง-กว้านซื้อ,16/9/2016 11:22,#กล้วยประหลาด #งวงช้าง #นายกฯ #หวยออก #เลขเด็ด #โค้งสุดท้าย,https://www.khaosod.co.th/breaking-news/news_13063,อุดรธานี,หนองวัวซอ,TRUE,FALSE,42,NA,16/9/2016 16:00,khaosod,16,11 11 11 16 10 42 79 11 11 11 11 12 60 80,0
ย้าย “จ้าวตะเคียนทองยักษ์” ไปไว้วัดจัดพิธีบูชาเทวดา ชาวบ้านแห่ไหว้-ขอเลขเด็ดเสี่ยงโชค (คลิป),15/9/2016 20:10,#ตะเคียนยักษ์ #นครศรีธรรมราช #เข้าฝันกำนัน,https://www.khaosod.co.th/around-thailand/news_12673,นครศรีธรรมราช,ปากพนัง,FALSE,FALSE,NA,NA,16/9/2016 16:00,khaosod,15,14 15 14,300
มากันแน่นวัด นักเสี่ยงโชคคึกคัก แห่ขอเลขเด็ดแม่ย่าตะเคียนทอง ในเรือโบราญเมืองสุพรรณ,15/9/2016 17:50,#,https://www.khaosod.co.th/around-thailand/news_12488,สุพรรณบุรี,เมืองสุพรรณบุรี,FALSE,FALSE,NA,NA,16/9/2016 16:00,khaosod,15,15 53,253 253
โค้งสุดท้ายหวยออก!! เศรษฐี30ล้าน รุดไหว้พญาเต่างอย ซื้อหวยชุดใหญ่-แห่ซื้อตามเลขเด็ดเกลี้ยง,15/9/2016 17:34,#30ล้าน #พญาเต่างอย #หวยพญาเต่า #เต่างอย #เลขเด็ด,https://www.khaosod.co.th/breaking-news/news_12464,สกลนคร,เต่างอย,FALSE,FALSE,NA,NA,16/9/2016 16:00,khaosod,15,15 13 14 15 16 13 16 30 63 63 30 13 15,649 649 179
เรือโบราณโผล่กลางแม่น้ำ!! เชื่อแม่ย่าตะเคียนทองให้โชค-ได้เลขเด็ด ล้นวัดคืนนี้ก่อนหวยออก,15/9/2016 16:52,#หวย #เรือโบราณ #เลขเด็ด #แม่ย่าตะเคียนทอง,https://www.khaosod.co.th/breaking-news/news_12394,สุพรรณบุรี,เมืองสุพรรณบุรี,FALSE,FALSE,NA,NA,16/9/2016 16:00,khaosod,15,15 53,253 253
แช็ตไลน์เลขเด็ดกระหึ่ม!! หวยอดีตรมต.-เจ้ามือไม่รับแล้ว รวมเลขเด็ดเชียงใหม่ที่นี่เลย,15/9/2016 9:42,#หวย #หวยเชียงใหม่ #เลขอดีตรมต. #เลขอดีตรัฐมนตรี #เลขเชียง #เลขเชียงใหม่ #เลขเด็ด,https://www.khaosod.co.th/breaking-news/news_11733,เชียงใหม่,เมืองเชียงใหม่,FALSE,FALSE,NA,NA,16/9/2016 16:00,khaosod,15,"15 11 89 25, 15 12, 89",889 911 930 989 803 889 989 930 803 911 889 911
ฮือฮา!! ลูกขนุนผุดจากใต้ดิน เจ้าของยังงงหนักไม่เคยเจอ-ชาวบ้านแห่ตีเลขเด็ด(คลิป),14/9/2016 17:57,#หวย,https://www.khaosod.co.th/breaking-news/news_11355,อุบลราชธานี,สิรินธร,FALSE,FALSE,NA,NA,16/9/2016 16:00,khaosod,14,14 38 25 15 15 38 20 20 80,0
สาวตกใจ!! ผ่ามะละกอออกมา-ข้างในเจอกล้วย เซียนหวยแห่ตีเลขเด็ด,14/9/2016 14:59,#มะละกอ #หวย #เลขเด็ด,https://www.khaosod.co.th/around-thailand/news_11185,ตรัง,ปะเหลียน,FALSE,FALSE,NA,NA,16/9/2016 16:00,khaosod,14,14 45 10 14,0
ฮือฮาถึงกับแก้ผ้ารำ!! แห่แก้บน‘พญาเต่างอย’สุดคึกคัก รวยสิบล้านก็มา เผยเลขเด็ดงวดนี้,5/9/2016 18:58,#,https://www.khaosod.co.th/breaking-news/news_10851,สกลนคร,เต่างอย,FALSE,FALSE,NA,NA,16/9/2016 16:00,khaosod,5,50,0
ฮือสะพัด ! รูปคล้ายใบหน้าพระพุทธเจ้าติดต้นไม้ ชาวบ้านเฮเสี่ยงเลขเด็ดใกล้วันหวยออก,31/8/2016 11:23,NA,https://www.matichon.co.th/news/268853,พะเยา,เมืองพะเยา,FALSE,FALSE,NA,NA,1/9/2016 16:00,matichon,31,31 12 48 61 86 12,500 487 500
